[
 {
  "record_id": "CASKEY-T3-1-RA",
  "doi": "OSTI-5906050",
  "first_author": "Caskey",
  "year": 1983,
  "open_access": true,
  "alloy_grade": "304L",
  "uns_number": null,
  "product_form": "unknown",
  "weld_process": "none",
  "heat_input_kJ_per_mm": null,
  "filler_metal": null,
  "zone": "base metal",
  "composition_wt_pct": {
   "C": 0.03,
   "Si": 0.43,
   "Mn": 1.57,
   "Cr": 19.0,
   "Ni": 10.0,
   "Mo": 0.17
  },
  "ni_equivalent": 24.69,
  "delta_ferrite_pct": null,
  "pre_strain_pct": null,
  "hydrogen_exposure": "gaseous in-situ",
  "h2_pressure_MPa": 69.0,
  "charging_current_density_A_per_m2": null,
  "charging_time_h": null,
  "hydrogen_content_wt_ppm": null,
  "test_temperature_K": 295.0,
  "strain_rate_per_s": null,
  "test_type": "tensile",
  "property_name": "reduction of area",
  "property_h2": 33.0,
  "relative_ratio": 0.407,
  "fracture_mode": "unknown",
  "derived_fields": [
   "relative_ratio",
   "ni_equivalent",
   "md30_calculated"
  ],
  "extraction_pass": 1,
  "human_verified": true,
  "notes": "Caskey DP-1643 Table 3. Condition: annealed. Reference environment 69 MPa helium, not air.  Composition from Caskey Table A-1 (nominal).",
  "property_reference": 81.0,
  "reference_environment": "helium",
  "composition_basis": "heat_analysis",
  "composition_source": "Caskey DP-1643 Appendix D Data Sheet D-1",
  "derived_assumptions": "N taken as 0 for the derived values",
  "ni_equivalent_reported": 24.69,
  "md30_calculated": 24.0
 },
 {
  "record_id": "CASKEY-T3-1-EL",
  "doi": "OSTI-5906050",
  "first_author": "Caskey",
  "year": 1983,
  "open_access": true,
  "alloy_grade": "304L",
  "uns_number": null,
  "product_form": "unknown",
  "weld_process": "none",
  "heat_input_kJ_per_mm": null,
  "filler_metal": null,
  "zone": "base metal",
  "composition_wt_pct": {
   "C": 0.03,
   "Si": 0.43,
   "Mn": 1.57,
   "Cr": 19.0,
   "Ni": 10.0,
   "Mo": 0.17
  },
  "ni_equivalent": 24.69,
  "delta_ferrite_pct": null,
  "pre_strain_pct": null,
  "hydrogen_exposure": "gaseous in-situ",
  "h2_pressure_MPa": 69.0,
  "charging_current_density_A_per_m2": null,
  "charging_time_h": null,
  "hydrogen_content_wt_ppm": null,
  "test_temperature_K": 295.0,
  "strain_rate_per_s": null,
  "test_type": "tensile",
  "property_name": "elongation",
  "property_h2": 48.0,
  "relative_ratio": 0.649,
  "fracture_mode": "unknown",
  "derived_fields": [
   "relative_ratio",
   "ni_equivalent",
   "md30_calculated"
  ],
  "extraction_pass": 1,
  "human_verified": true,
  "notes": "Caskey DP-1643 Table 3. Condition: annealed. Reference environment 69 MPa helium, not air.  Composition from Caskey Table A-1 (nominal).",
  "property_reference": 74.0,
  "reference_environment": "helium",
  "composition_basis": "heat_analysis",
  "composition_source": "Caskey DP-1643 Appendix D Data Sheet D-1",
  "derived_assumptions": "N taken as 0 for the derived values",
  "ni_equivalent_reported": 24.69,
  "md30_calculated": 24.0
 },
 {
  "record_id": "CASKEY-T3-2-RA",
  "doi": "OSTI-5906050",
  "first_author": "Caskey",
  "year": 1983,
  "open_access": true,
  "alloy_grade": "304L",
  "uns_number": null,
  "product_form": "unknown",
  "weld_process": "none",
  "heat_input_kJ_per_mm": null,
  "filler_metal": null,
  "zone": "base metal",
  "composition_wt_pct": {
   "C": 0.03,
   "Si": 0.43,
   "Mn": 1.57,
   "Cr": 19.0,
   "Ni": 10.0,
   "Mo": 0.17
  },
  "ni_equivalent": 24.69,
  "delta_ferrite_pct": null,
  "pre_strain_pct": null,
  "hydrogen_exposure": "gaseous in-situ",
  "h2_pressure_MPa": 69.0,
  "charging_current_density_A_per_m2": null,
  "charging_time_h": null,
  "hydrogen_content_wt_ppm": null,
  "test_temperature_K": 295.0,
  "strain_rate_per_s": null,
  "test_type": "tensile",
  "property_name": "reduction of area",
  "property_h2": 69.0,
  "relative_ratio": 0.896,
  "fracture_mode": "unknown",
  "derived_fields": [
   "relative_ratio",
   "ni_equivalent",
   "md30_calculated"
  ],
  "extraction_pass": 1,
  "human_verified": true,
  "notes": "Caskey DP-1643 Table 3. Condition: HERF (high energy rate forged). Reference environment 69 MPa helium, not air.  Composition from Caskey Table A-1 (nominal).",
  "property_reference": 77.0,
  "reference_environment": "helium",
  "composition_basis": "heat_analysis",
  "composition_source": "Caskey DP-1643 Appendix D Data Sheet D-1",
  "derived_assumptions": "N taken as 0 for the derived values",
  "ni_equivalent_reported": 24.69,
  "md30_calculated": 24.0
 },
 {
  "record_id": "CASKEY-T3-2-EL",
  "doi": "OSTI-5906050",
  "first_author": "Caskey",
  "year": 1983,
  "open_access": true,
  "alloy_grade": "304L",
  "uns_number": null,
  "product_form": "unknown",
  "weld_process": "none",
  "heat_input_kJ_per_mm": null,
  "filler_metal": null,
  "zone": "base metal",
  "composition_wt_pct": {
   "C": 0.03,
   "Si": 0.43,
   "Mn": 1.57,
   "Cr": 19.0,
   "Ni": 10.0,
   "Mo": 0.17
  },
  "ni_equivalent": 24.69,
  "delta_ferrite_pct": null,
  "pre_strain_pct": null,
  "hydrogen_exposure": "gaseous in-situ",
  "h2_pressure_MPa": 69.0,
  "charging_current_density_A_per_m2": null,
  "charging_time_h": null,
  "hydrogen_content_wt_ppm": null,
  "test_temperature_K": 295.0,
  "strain_rate_per_s": null,
  "test_type": "tensile",
  "property_name": "elongation",
  "property_h2": 41.0,
  "relative_ratio": 0.953,
  "fracture_mode": "unknown",
  "derived_fields": [
   "relative_ratio",
   "ni_equivalent",
   "md30_calculated"
  ],
  "extraction_pass": 1,
  "human_verified": true,
  "notes": "Caskey DP-1643 Table 3. Condition: HERF (high energy rate forged). Reference environment 69 MPa helium, not air.  Composition from Caskey Table A-1 (nominal).",
  "property_reference": 43.0,
  "reference_environment": "helium",
  "composition_basis": "heat_analysis",
  "composition_source": "Caskey DP-1643 Appendix D Data Sheet D-1",
  "derived_assumptions": "N taken as 0 for the derived values",
  "ni_equivalent_reported": 24.69,
  "md30_calculated": 24.0
 },
 {
  "record_id": "CASKEY-T3-3-RA",
  "doi": "OSTI-5906050",
  "first_author": "Caskey",
  "year": 1983,
  "open_access": true,
  "alloy_grade": "310",
  "uns_number": null,
  "product_form": "unknown",
  "weld_process": "none",
  "heat_input_kJ_per_mm": null,
  "filler_metal": null,
  "zone": "base metal",
  "composition_wt_pct": {
   "C": 0.25,
   "Cr": 25.0,
   "Ni": 20.0
  },
  "ni_equivalent": null,
  "delta_ferrite_pct": null,
  "pre_strain_pct": null,
  "hydrogen_exposure": "gaseous in-situ",
  "h2_pressure_MPa": 69.0,
  "charging_current_density_A_per_m2": null,
  "charging_time_h": null,
  "hydrogen_content_wt_ppm": null,
  "test_temperature_K": 295.0,
  "strain_rate_per_s": null,
  "test_type": "tensile",
  "property_name": "reduction of area",
  "property_h2": 79.0,
  "relative_ratio": 0.963,
  "fracture_mode": "unknown",
  "derived_fields": [
   "relative_ratio"
  ],
  "extraction_pass": 1,
  "human_verified": true,
  "notes": "Caskey DP-1643 Table 3. Condition: annealed. Reference environment 69 MPa helium, not air. stable austenite Composition from Caskey Table A-1 (nominal).",
  "property_reference": 82.0,
  "reference_environment": "helium",
  "composition_basis": "nominal",
  "composition_source": "Caskey DP-1643 Table A-1"
 },
 {
  "record_id": "CASKEY-T3-3-EL",
  "doi": "OSTI-5906050",
  "first_author": "Caskey",
  "year": 1983,
  "open_access": true,
  "alloy_grade": "310",
  "uns_number": null,
  "product_form": "unknown",
  "weld_process": "none",
  "heat_input_kJ_per_mm": null,
  "filler_metal": null,
  "zone": "base metal",
  "composition_wt_pct": {
   "C": 0.25,
   "Cr": 25.0,
   "Ni": 20.0
  },
  "ni_equivalent": null,
  "delta_ferrite_pct": null,
  "pre_strain_pct": null,
  "hydrogen_exposure": "gaseous in-situ",
  "h2_pressure_MPa": 69.0,
  "charging_current_density_A_per_m2": null,
  "charging_time_h": null,
  "hydrogen_content_wt_ppm": null,
  "test_temperature_K": 295.0,
  "strain_rate_per_s": null,
  "test_type": "tensile",
  "property_name": "elongation",
  "property_h2": 66.0,
  "relative_ratio": 0.985,
  "fracture_mode": "unknown",
  "derived_fields": [
   "relative_ratio"
  ],
  "extraction_pass": 1,
  "human_verified": true,
  "notes": "Caskey DP-1643 Table 3. Condition: annealed. Reference environment 69 MPa helium, not air. stable austenite Composition from Caskey Table A-1 (nominal).",
  "property_reference": 67.0,
  "reference_environment": "helium",
  "composition_basis": "nominal",
  "composition_source": "Caskey DP-1643 Table A-1"
 },
 {
  "record_id": "CASKEY-T3-4-RA",
  "doi": "OSTI-5906050",
  "first_author": "Caskey",
  "year": 1983,
  "open_access": true,
  "alloy_grade": "310",
  "uns_number": null,
  "product_form": "unknown",
  "weld_process": "none",
  "heat_input_kJ_per_mm": null,
  "filler_metal": null,
  "zone": "base metal",
  "composition_wt_pct": {
   "C": 0.25,
   "Cr": 25.0,
   "Ni": 20.0
  },
  "ni_equivalent": null,
  "delta_ferrite_pct": null,
  "pre_strain_pct": null,
  "hydrogen_exposure": "gaseous in-situ",
  "h2_pressure_MPa": 69.0,
  "charging_current_density_A_per_m2": null,
  "charging_time_h": null,
  "hydrogen_content_wt_ppm": null,
  "test_temperature_K": 295.0,
  "strain_rate_per_s": null,
  "test_type": "tensile",
  "property_name": "reduction of area",
  "property_h2": 70.0,
  "relative_ratio": 0.986,
  "fracture_mode": "unknown",
  "derived_fields": [
   "relative_ratio"
  ],
  "extraction_pass": 1,
  "human_verified": true,
  "notes": "Caskey DP-1643 Table 3. Condition: HERF. Reference environment 69 MPa helium, not air. stable austenite Composition from Caskey Table A-1 (nominal).",
  "property_reference": 71.0,
  "reference_environment": "helium",
  "composition_basis": "nominal",
  "composition_source": "Caskey DP-1643 Table A-1"
 },
 {
  "record_id": "CASKEY-T3-4-EL",
  "doi": "OSTI-5906050",
  "first_author": "Caskey",
  "year": 1983,
  "open_access": true,
  "alloy_grade": "310",
  "uns_number": null,
  "product_form": "unknown",
  "weld_process": "none",